{
  "strategy_id": "sample-vertical-001",
  "version": "1.0.0",
  "name": "Sample ATM Debit Call Vertical",
  "structure_type": "VERTICAL",
  "underlyings": ["SPX"],
  "timeframe": {"bar": "1m", "session": "RTH"},
  "entry_window": {
    "timezone": "America/Chicago",
    "first_trade_time": "08:40",
    "last_new_entry_time": "09:30"
  },
  "regime_filters": {
    "iv_rank_min": 20,
    "iv_rank_max": 80,
    "rv_iv_spread_min": -20,
    "event_blackout": true
  },
  "legs": [
    {
      "side": "BUY",
      "option_type": "CALL",
      "expiry_rule": {"kind": "DTE", "target": 0},
      "strike_rule": {"kind": "DELTA", "target": 0.50},
      "qty_ratio": 1
    },
    {
      "side": "SELL",
      "option_type": "CALL",
      "expiry_rule": {"kind": "DTE", "target": 0},
      "strike_rule": {"kind": "DELTA", "target": 0.25},
      "qty_ratio": 1
    }
  ],
  "position_sizing": {"method": "fixed_contracts", "contracts": 1},
  "adjustments": {"allow_roll": true, "recenter_on_delta": 0.2},
  "exits": {"take_profit_pct": 1.5, "stop_loss_pct": 0.5, "max_dte_exit": 0},
  "cost_model": {"commission_per_contract": 0.65, "exchange_fee_per_contract": 0.03, "slippage_bps": 5},
  "risk_limits": {"max_entry_debit": 5.0, "max_strategy_drawdown_pct": 20.0, "max_portfolio_alloc_pct": 15.0},
  "validation_plan": {
    "train": {"start": "2025-10-01", "end": "2026-01-31"},
    "test": {"start": "2026-02-01", "end": "2026-03-01"},
    "walk_forward_windows": 5
  },
  "meta": {"spread_style": "debit"}
}
